{
  "format": "reverse.scenario-example.v1",
  "scenario_id": "grade6-1945-no-atomic-bomb",
  "school_level": "elementary",
  "grade": 6,
  "grade_label": "초6",
  "subject_id": "social-studies",
  "subject_label": "사회",
  "unit": "광복과 대한민국의 수립",
  "safety_risk": "MEDIUM",
  "source_boundary": "SESSION_EVIDENCE_ONLY",
  "creative_boundary": "LOCAL_SCENE_ONLY",
  "live_status": "REFERENCE_FIXTURE_NOT_LIVE_VERIFIED",
  "regression_case_ids": ["SCN-E6-SOC-COUNTERFACTUAL-001"]
}
